{
  "$schema": "./.harness/schema/harness-settings.schema.json",
  "version": 1,
  "quality": {
    "lint": { "mode": "required", "strategy": "changed" },
    "format": { "mode": "required", "strategy": "changed" },
    "typecheck": { "mode": "advisory", "strategy": "affected" },
    "test": { "mode": "advisory", "strategy": "affected" },
    "build": { "mode": "advisory", "strategy": "affected" }
  },
  "lifecycle": {
    "postEdit": [],
    "stop": ["lint", "format", "typecheck"]
  },
  "execution": { "timeoutMs": 120000, "maxOutputBytes": 8192 },
  "guards": {
    "dangerousCommands": { "mode": "required" },
    "protectedFiles": { "mode": "required" },
    "secrets": { "mode": "required" }
  },
  "promotion": {
    "mode": "advisory",
    "issueMode": "manual",
    "repositoryThreshold": 0.7,
    "pluginThreshold": 0.8
  }
}
